[
  {
    "username": "johndoe",
    "name": "John Doe",
    "shareType": "small",
    "depot": "Krummennaab"
  },
  {
    "username": "aa",
    "name": "Alex Awesome",
    "shareType": "big",
    "depot": "Weiden"
  },
  {
    "username": "jens",
    "name": "Udo Oinki",
    "shareType": "big",
    "depot": "Krummennaab"
  },
  {
    "username": "boris",
    "name": "Da Boris",
    "shareType": "small",
    "depot": "Weiden"
  }

]
